{
  "$schema": "../schemas/supplement-catalogue.schema.json",
  "$comment": "Herbs, teas, bush remedies and supplements (rule set supplement-catalogue, clinical-content/registry.json). The single source for web (artifacts/dashboard/src/lib/supplement-catalogue.ts) and iOS (SupplementCatalogue.swift, bundled folder \"rules\"). Validated by lint:shared-content. Items with interaction rules name a drug-classes term (drug-classes.ts / DrugClasses.swift), which holds their names. Stop times are clinician-facing only. text.herbalPreOpPatientText is the surgeon-approved patient paragraph (2026-09-25): change it only on his instruction; lint:patient-instructions pins it.",
  "id": "supplement-catalogue",
  "version": "1.0.0",
  "items": [
    {
      "id": "garlic",
      "label": "Garlic (supplement)",
      "term": "garlic",
      "names": "",
      "concern": "Platelet inhibition; the strongest link to surgical bleeding, especially with anticoagulants",
      "stopTime": "at least 7 days; many advise 2 weeks",
      "harms": "",
      "evidence": "Evidence for cardiovascular claims is inconsistent. Normal amounts in food are not the concern.",
      "source": "Ang-Lee MK et al. JAMA 2001;286:208-16; Proc (Bayl Univ Med Cent) 2022"
    },
    {
      "id": "ginkgo",
      "label": "Ginkgo",
      "term": "ginkgo",
      "names": "",
      "concern": "Platelet-activating factor inhibition; bleeding, especially with anticoagulants",
      "stopTime": "at least 36 hours; SPAQI advises 2 weeks",
      "harms": "",
      "evidence": "Evidence for cognitive claims is inconsistent.",
      "source": "Ang-Lee MK et al. JAMA 2001;286:208-16; OpenAnesthesia / SPAQI 2025"
    },
    {
      "id": "ginger",
      "label": "Ginger (supplement)",
      "term": "ginger",
      "names": "",
      "concern": "Thromboxane synthetase inhibition (bleeding)",
      "stopTime": "2 weeks (SPAQI)",
      "harms": "",
      "evidence": "Normal amounts in food are not the concern; tablets, capsules, extracts and strong teas are.",
      "source": "OpenAnesthesia / SPAQI 2025"
    },
    {
      "id": "turmeric",
      "label": "Turmeric / curcumin",
      "term": "turmeric",
      "names": "",
      "concern": "Drug-induced liver injury (hepatocellular, typically 1–4 months after starting; linked to HLA-B*35:01); raises bleeding risk with anticoagulants",
      "stopTime": "2 weeks; check LFTs if symptomatic",
      "harms": "Liver: US DILIN reported 10 cases (all since 2011), 5 hospitalised and 1 death from acute liver failure. Metal: some turmeric products have been adulterated with lead chromate.",
      "evidence": "Culinary turmeric is fine; the risk is high-dose, bioavailability-enhanced capsules (black pepper / piperine or nanoparticle forms). Benefit is weak beyond a small effect on osteoarthritis pain.",
      "source": "Halegoua-DeMarzio D et al. Am J Med 2023;136:200-206 (DILIN); J Clin Anesth 2024 review"
    },
    {
      "id": "ashwagandha",
      "label": "Ashwagandha",
      "term": "ashwagandha",
      "names": "",
      "concern": "Drug-induced liver injury, typically cholestatic with severe jaundice and itch, resolving over 1–5 months, sometimes fatal",
      "stopTime": "2 weeks; check LFTs if symptomatic",
      "harms": "Liver: LiverTox lists it as a likely cause of clinically apparent liver injury. Denmark banned ashwagandha supplements in 2023 (thyroid and sex-hormone effects). Avoid in liver disease, pregnancy and thyroid disease.",
      "evidence": "Small trials suggest reduced perceived stress.",
      "source": "NIDDK LiverTox: Ashwagandha (Dec 2024); Björnsson HK et al. Liver Int 2020;40:825-9"
    },
    {
      "id": "ginseng",
      "label": "Ginseng",
      "term": "ginseng",
      "names": "",
      "concern": "Hypoglycaemia, especially in fasting patients (pre-op fast or religious fast); possible platelet effects; reduced INR reported with warfarin",
      "stopTime": "at least 7 days; SPAQI advises 2 weeks",
      "harms": "",
      "evidence": "Evidence for energy and cognitive claims is inconsistent.",
      "source": "Ang-Lee MK et al. JAMA 2001;286:208-16; OpenAnesthesia / SPAQI 2025"
    },
    {
      "id": "st_johns_wort",
      "label": "St John's wort",
      "term": "st johns wort",
      "names": "",
      "concern": "CYP3A4 induction: lowers levels of warfarin, ciclosporin, tacrolimus, DOACs, hormonal contraceptives and many anaesthetic drugs; serotonin syndrome with serotonergic drugs",
      "stopTime": "at least 5 days",
      "harms": "",
      "evidence": "",
      "source": "Ang-Lee MK et al. JAMA 2001;286:208-16; BNF interactions (St John's wort)"
    },
    {
      "id": "kava",
      "label": "Kava",
      "term": "kava",
      "names": "",
      "concern": "Potentiates anaesthetic sedation",
      "stopTime": "24 hours",
      "harms": "",
      "evidence": "",
      "source": "Ang-Lee MK et al. JAMA 2001;286:208-16"
    },
    {
      "id": "valerian",
      "label": "Valerian",
      "term": "valerian",
      "names": "",
      "concern": "Potentiates anaesthetic sedation; stopping suddenly can cause a benzodiazepine-like withdrawal",
      "stopTime": "taper over 1–2 weeks (do not stop suddenly)",
      "harms": "",
      "evidence": "",
      "source": "Ang-Lee MK et al. JAMA 2001;286:208-16"
    },
    {
      "id": "echinacea",
      "label": "Echinacea",
      "term": "echinacea",
      "names": "",
      "concern": "Immune effects; avoid if immunosuppression is planned",
      "stopTime": "stop early before transplant-type surgery",
      "harms": "",
      "evidence": "",
      "source": "Ang-Lee MK et al. JAMA 2001;286:208-16"
    },
    {
      "id": "ephedra",
      "label": "Ephedra (ma huang)",
      "term": "ephedra",
      "names": "",
      "concern": "Hypertension and arrhythmia (sympathomimetic); interacts with MAOIs and anaesthesia",
      "stopTime": "at least 24 hours; ideally avoid entirely",
      "harms": "Whole-herb ephedra weight-loss supplements caused cardiovascular deaths and were banned by the US FDA in 2004.",
      "evidence": "",
      "source": "Ang-Lee MK et al. JAMA 2001;286:208-16"
    },
    {
      "id": "ayurvedic_metals",
      "label": "Ayurvedic preparation (rasa shastra / metal-based)",
      "term": "",
      "names": "ayurvedic|ayurveda|rasa shastra|bhasma",
      "concern": "Heavy-metal poisoning (lead, mercury, arsenic)",
      "stopTime": "",
      "harms": "Metal: 20.7% of Ayurvedic medicines bought online (US- and Indian-made) contained lead, mercury or arsenic; metal-based rasa shastra products were more than twice as likely to contain metals; a 2015 review attributed 19% of published lead-poisoning cases to Ayurvedic medicines.",
      "evidence": "",
      "source": "Saper RB et al. JAMA 2008;300:915-23; Public Health Ontario fact sheet (2019)"
    },
    {
      "id": "aristolochia",
      "label": "Chinese herbal slimming product (aristolochic acid risk)",
      "term": "",
      "names": "aristolochia|aristolochic acid|aristolochia fangchi|guang fang ji|chinese herbal slimming|chinese slimming|slimming pills|herbal weight-loss",
      "concern": "Aristolochic acid nephropathy (rapidly progressive kidney failure) and upper-tract urothelial carcinoma",
      "stopTime": "",
      "harms": "Renal and cancer: in the Belgian slimming-pill cluster (Stephania tetrandra substituted with Aristolochia fangchi) more than 100 women developed rapidly progressive kidney failure; 46% of 39 who later had prophylactic ureteronephrectomy had urothelial cancer.",
      "evidence": "",
      "source": "Nortier JL et al. N Engl J Med 2000;342:1686-92; Debelle FD et al. Kidney Int 2008"
    },
    {
      "id": "detox_cleanse",
      "label": "Detox tea / colon cleanse / laxative cleanse",
      "term": "",
      "names": "detox tea|detox teas|colon cleanse|colon cleansing|cleanse tea|laxative tea|slimming tea|skinny tea|body cleanse",
      "concern": "Dehydration, electrolyte disturbance, laxative dependence",
      "stopTime": "",
      "harms": "",
      "evidence": "No reliable evidence of benefit beyond placebo.",
      "source": "Owner evidence briefing (Kabiye, Sept 2026) §6"
    },
    {
      "id": "iv_vitamin_drip",
      "label": "IV vitamin drip (outside clinical care)",
      "term": "",
      "names": "iv vitamin drip|vitamin drip|iv vitamin infusion|iv drip therapy|myers cocktail|iv glutathione",
      "concern": "Infection and fluid risks",
      "stopTime": "",
      "harms": "",
      "evidence": "Little outcome evidence for healthy people outside specific medical indications.",
      "source": "Owner evidence briefing (Kabiye, Sept 2026) §6"
    },
    {
      "id": "spermidine",
      "label": "Spermidine / \"autophagy booster\"",
      "term": "",
      "names": "spermidine|autophagy booster|autophagy supplement",
      "concern": "No benefit shown in humans (SmartAge RCT)",
      "stopTime": "",
      "harms": "",
      "evidence": "The 12-month placebo-controlled SmartAge trial (100 older adults) found no improvement in memory or biomarkers. Recording it is enough.",
      "source": "Schwarz C et al. JAMA Netw Open 2022;5:e2213875 (SmartAge)"
    },
    {
      "id": "bush_tea",
      "label": "Bush tea / herbal remedy (unspecified)",
      "term": "",
      "names": "bush tea|bush medicine|bush remedy|herbal tea|herbal remedy|herbal mixture|herbal medicine",
      "concern": "Plant not identified: interactions and perioperative risk unknown",
      "stopTime": "identify the plant; stop non-essential herbal products 1–2 weeks before elective surgery (ASA / SPAQI) — clinician to confirm",
      "harms": "",
      "evidence": "",
      "source": "ASA / SPAQI (OpenAnesthesia 2025); J Clin Anesth 2024 review"
    }
  ],
  "text": {
    "sectionTitle": "Herbs, teas, bush remedies & supplements",